### ISSUE TITLE
docker build inside container: connection timed out

### ISSUE THREAD

**Issue by r0bj** [projectcalico/calicoctl#1613]
calico/node: v1.1.0
calico/cni: v1.6.1
kubernetes: 1.5.5
docker: 1.12.6
OS: ubuntu 14.04

Running `docker build` inside docker container failed because of connectivity issue.

Kubernetes workload:
```
apiVersion: extensions/v1beta1
kind: Deployment
metadata:
  name: ubuntu-test
spec:
  replicas: 1
  template:
    metadata:
      labels:
        app: ubuntu-test
    spec:
      containers:
      - name: ubuntu-test
        image: ubuntu:16.04
        args:
        - /bin/sh
        - -c
        - while true; do sleep 3600; done
        volumeMounts:
        - name: docker
          mountPath: /var/run/docker.sock
      volumes:
      - name: docker
        hostPath:
          path: /var/run/docker.sock
```

Inside container (install docker and prepare Dockerfile):
```
apt-get update && apt-get install -y docker.io
mkdir test && cd test
cat <<EOF > Dockerfile
FROM alpine:3.5
RUN wget -T 10 http://noc.pirx.pl/100mb.bin
EOF
```

Result:
```
# docker build -t test .
Sending build context to Docker daemon 168.6 MB
Step 1 : FROM alpine:3.5
 ---> 4a415e366388
Step 2 : RUN wget -T 10 http://noc.pirx.pl/100mb.bin
 ---> Running in e51ae496d4ce
Connecting to noc.pirx.pl (193.47.247.4:80)
wget: download timed out
The command '/bin/sh -c wget -T 10 http://noc.pirx.pl/100mb.bin' returned a non-zero code: 1
```

Connectivity from container itself works fine:
```
# wget -T 10 http://noc.pirx.pl/100mb.bin
--2017-04-20 14:20:36--  http://noc.pirx.pl/100mb.bin
Resolving noc.pirx.pl (noc.pirx.pl)... 193.47.247.4, 2a02:2780:0:100::1:4
Connecting to noc.pirx.pl (noc.pirx.pl)|193.47.247.4|:80... connected.
HTTP request sent, awaiting response... 200 OK
Length: 104857600 (100M) [application/octet-stream]
Saving to: '100mb.bin'

100mb.bin           100%[===================>] 100.00M  16.5MB/s    in 7.6s

2017-04-20 14:20:44 (13.2 MB/s) - '100mb.bin' saved [104857600/104857600]
```

Networking inside container looks ok:
```
# ip a
1: lo: <LOOPBACK,UP,LOWER_UP> mtu 65536 qdisc noqueue state UNKNOWN group default qlen 1
    link/loopback 00:00:00:00:00:00 brd 00:00:00:00:00:00
    inet 127.0.0.1/8 scope host lo
       valid_lft forever preferred_lft forever
    inet6 ::1/128 scope host
       valid_lft forever preferred_lft forever
2: tunl0@NONE: <NOARP> mtu 1480 qdisc noop state DOWN group default qlen 1
    link/ipip 0.0.0.0 brd 0.0.0.0
4: eth0@if459: <BROADCAST,MULTICAST,UP,LOWER_UP> mtu 1500 qdisc noqueue state UP group default
    link/ether 12:bc:c2:af:60:80 brd ff:ff:ff:ff:ff:ff link-netnsid 0
    inet 10.200.138.178/32 scope global eth0
       valid_lft forever preferred_lft forever
    inet6 fe80::10bc:c2ff:feaf:6080/64 scope link
       valid_lft forever preferred_lft forever
```

```
# ip r
default via 169.254.1.1 dev eth0
169.254.1.1 dev eth0  scope link
```

`docker build` works fine with standard docker installation with default networking (without calico).
It's only visible in docker container using calico networking.

I hit this issue during work on CI/DC tool which at some stage tries to build docker image.

I'm not sure where to look for solution, It may be related to how `docker build` works.

Is there any work around for that?

**Comment by tomdee** [comment]
IIUC the docker build inside the container is using the docker daemon on the host. Do you have internet connectivity on the host?

**Comment by r0bj** [comment]
@tomdee yes, internet connectivity is fine on the host, it's regular kubernetes node:
```
# wget -T 10 http://noc.pirx.pl/100mb.bin
--2017-04-21 09:20:15--  http://noc.pirx.pl/100mb.bin
Resolving noc.pirx.pl (noc.pirx.pl)... 193.47.247.4, 2a02:2780:0:100::1:4
Connecting to noc.pirx.pl (noc.pirx.pl)|193.47.247.4|:80... connected.
HTTP request sent, awaiting response... 200 OK
Length: 104857600 (100M) [application/octet-stream]
Saving to: ‘100mb.bin’

100%[===========================================================================================================================================>] 104,857,600 16.7MB/s   in 7.6s

2017-04-21 09:20:23 (13.1 MB/s) - ‘100mb.bin’ saved [104857600/104857600]
```

**Comment by r0bj** [comment]
More debugging shows that it's probably issue with NAT.

tcpdump on host:
```
# tcpdump -pni any host 193.47.247.4
tcpdump: verbose output suppressed, use -v or -vv for full protocol decode
listening on any, link-type LINUX_SLL (Linux cooked), capture size 65535 bytes
09:24:13.686923 IP 172.17.0.2.42590 > 193.47.247.4.80: Flags [S], seq 3585092858, win 29200, options [mss 1460,sackOK,TS val 815706083 ecr 0,nop,wscale 9], length 0
09:24:13.686923 IP 172.17.0.2.42590 > 193.47.247.4.80: Flags [S], seq 3585092858, win 29200, options [mss 1460,sackOK,TS val 815706083 ecr 0,nop,wscale 9], length 0
09:24:13.686945 IP 172.17.0.2.42590 > 193.47.247.4.80: Flags [S], seq 3585092858, win 29200, options [mss 1460,sackOK,TS val 815706083 ecr 0,nop,wscale 9], length 0
```

So packets are leaving host with internal address `172.17.0.2` without NAT.

Since recomended method of running docker in kubernetes is to use parameters `--iptables=false --ip-masq=false` so there is no iptables rule similar to:

```
Chain POSTROUTING (policy ACCEPT 3122K packets, 189M bytes)
 pkts bytes target     prot opt in     out     source               destination
1710K  103M MASQUERADE  all  --  *      !docker0  172.17.0.0/16        0.0.0.0/0
```

calico puts NAT rule only like this:
```
Chain cali-POSTROUTING (1 references)
 pkts bytes target     prot opt in     out     source               destination
1768M 1158G cali-fip-snat  all  --  *      *       0.0.0.0/0            0.0.0.0/0            /* cali:Z-c7XtVd2Bq7s_hA */
1768M 1158G cali-nat-outgoing  all  --  *      *       0.0.0.0/0            0.0.0.0/0            /* cali:nYKhEzDlr11Jccal */
    0     0 MASQUERADE  all  --  *      tunl0   0.0.0.0/0            0.0.0.0/0            /* cali:JHlpT-eSqR1TvyYm */ ADDRTYPE match src-type !LOCAL limit-out ADDRTYPE match src-type LOCAL
```

So there is no proper NAT rule for such traffic (out: !docker0, source: 172.17.0.0/16).

Is there any way to extend NAT calico rules for that kind of traffic?

Or maybe should I set docker daemon with `ip-masq=true`? Is it compatible with calico?

**Comment by tmjd** [comment]
Are you explicitly setting `--iptables=false --ip-masq=false` for docker? Try running without those.
I was able to do what you were attempting using:
calico/node: v1.1.0
calico/cni: v1.6.1
kubernetes: 1.5.1
docker: 1.12.6
OS: Container Linux by CoreOS 1298.5.0

I could not find any specific setting of iptables or ip-masq for docker so that may be the problem.

**Comment by r0bj** [comment]
@tmjd you are right,  I've tested this without setting options `--iptables=false --ip-masq=false` and `docker build` from the container works as expected.
I just thought those docker daemon options would interfere with iptables rules managed by `kube-proxy` or `calico` itself.

Thanks a lot for help!

**Comment by tmjd** [comment]
That's great.  Thanks for reporting back.
The components have all figured out how to be friends and play nicely together. :grinning:
